{
  "$schema": "https://buildora-hazel.vercel.app/schema/registry-item.json",
  "id": "masonry-layout",
  "name": "Masonry Layout",
  "slug": "masonry-layout",
  "description": "Pinterest-style masonry columns.",
  "categories": [
    "primitives"
  ],
  "tags": [
    "layout",
    "masonry"
  ],
  "difficulty": "intermediate",
  "version": "0.1.0",
  "license": "MIT",
  "status": "beta",
  "collection": "kit",
  "states": [],
  "implementations": {
    "react": {
      "status": "Full",
      "files": [
        "packages/components/src/layouts/masonry-layout.tsx"
      ]
    },
    "javascript": {
      "status": "Partial",
      "notes": "Snippet-level port. React is the source of truth; no dedicated JS runtime.",
      "files": [
        "packages/components/src/layouts/masonry-layout.tsx"
      ]
    },
    "vue": {
      "status": "Partial",
      "notes": "Composition API snippet port. React is the source of truth.",
      "files": [
        "packages/components/src/layouts/masonry-layout.tsx"
      ]
    },
    "svelte": {
      "status": "Partial",
      "notes": "Svelte runes snippet port. React is the source of truth.",
      "files": [
        "packages/components/src/layouts/masonry-layout.tsx"
      ]
    },
    "angular": {
      "status": "Partial",
      "notes": "Angular @Input snippet port. React is the source of truth.",
      "files": [
        "packages/components/src/layouts/masonry-layout.tsx"
      ]
    },
    "html": {
      "status": "Partial",
      "notes": "Static markup snippet. Interactive behavior requires the React implementation.",
      "files": [
        "packages/components/src/layouts/masonry-layout.tsx"
      ]
    },
    "tailwind": {
      "status": "Partial",
      "notes": "Tailwind variant snippet, not a standalone component.",
      "files": [
        "packages/components/src/layouts/masonry-layout.tsx"
      ]
    },
    "reactNative": {
      "status": "Partial",
      "notes": "No hover/cursor on mobile; use press + haptics. Snippet port.",
      "files": [
        "packages/components/src/layouts/masonry-layout.tsx"
      ]
    },
    "flutter": {
      "status": "Experimental",
      "notes": "Experimental snippet port; pointer interactions remapped to gestures.",
      "files": [
        "packages/components/src/layouts/masonry-layout.tsx"
      ]
    },
    "swiftUI": {
      "status": "Experimental",
      "notes": "Experimental snippet port; pointer interactions remapped.",
      "files": [
        "packages/components/src/layouts/masonry-layout.tsx"
      ]
    },
    "compose": {
      "status": "Experimental",
      "notes": "Experimental snippet port; pointer interactions remapped.",
      "files": [
        "packages/components/src/layouts/masonry-layout.tsx"
      ]
    }
  },
  "accessibility": {
    "keyboard": true,
    "screenReader": true,
    "reducedMotion": true
  },
  "dependencies": [],
  "registryDependencies": [
    "https://buildora-hazel.vercel.app/r/utils.json",
    "https://buildora-hazel.vercel.app/r/tokens.json"
  ],
  "provenance": {
    "origin": "original",
    "license": "MIT",
    "adapted": false
  },
  "files": [
    {
      "path": "packages/components/src/layouts/masonry-layout.tsx",
      "target": "components/buildora/masonry-layout/masonry-layout.tsx",
      "content": "\"use client\";\n\nimport * as React from \"react\";\nimport { cn } from \"@/lib/buildora/utils\";\n\nexport type MasonryLayoutProps = React.HTMLAttributes<HTMLDivElement> & {\n  columns?: number;\n  gap?: number;\n};\n\nexport type MasonryItemProps = React.HTMLAttributes<HTMLDivElement>;\n\nfunction MasonryLayout({\n  columns = 3,\n  gap = 16,\n  className,\n  children,\n  ...rest\n}: MasonryLayoutProps) {\n  const [columnHeights, setColumnHeights] = React.useState<number[]>([]);\n  const containerRef = React.useRef<HTMLDivElement | null>(null);\n\n  const childArray = React.Children.toArray(children);\n\n  const distributedItems = React.useMemo(() => {\n    if (childArray.length === 0) return [];\n\n    const columnItems: Array<Array<{ child: React.ReactNode; index: number }>> = \n      Array.from({ length: columns }, () => []);\n    \n    const columnHeights = new Array(columns).fill(0);\n\n    childArray.forEach((child, index) => {\n      const shortestColumn = columnHeights.indexOf(Math.min(...columnHeights));\n      columnItems[shortestColumn].push({ child, index });\n      columnHeights[shortestColumn] += 100;\n    });\n\n    return columnItems;\n  }, [childArray, columns]);\n\n  return (\n    <div\n      ref={containerRef}\n      className={cn(\"flex\", className)}\n      style={{ gap: `${gap}px` }}\n      {...rest}\n    >\n      {distributedItems.map((columnItems, colIndex) => (\n        <div\n          key={colIndex}\n          className=\"flex flex-1 flex-col\"\n          style={{ gap: `${gap}px` }}\n        >\n          {columnItems.map(({ child, index }) => (\n            <React.Fragment key={index}>{child}</React.Fragment>\n          ))}\n        </div>\n      ))}\n    </div>\n  );\n}\n\nfunction MasonryItem({ className, children, ...rest }: MasonryItemProps) {\n  return (\n    <div\n      className={cn(\n        \"rounded-xl border border-[color-mix(in_oklab,var(--b-border)_10%,transparent)] bg-[color:var(--b-bg)] p-4\",\n        \"transition-all duration-200 hover:border-[color-mix(in_oklab,var(--b-border)_20%,transparent)]\",\n        className\n      )}\n      {...rest}\n    >\n      {children}\n    </div>\n  );\n}\n\nMasonryLayout.displayName = \"MasonryLayout\";\nMasonryItem.displayName = \"MasonryLayout.Item\";\n\nexport { MasonryLayout, MasonryItem };\n"
    }
  ],
  "github": "https://github.com/Varun9490/Buildora/tree/main/packages/components/src/layouts/masonry-layout.tsx",
  "githubFile": "https://github.com/Varun9490/Buildora/blob/main/packages/components/src/layouts/masonry-layout.tsx",
  "sourceDir": "layouts/masonry-layout.tsx",
  "docs": "/components/masonry-layout",
  "install": "pnpm dlx shadcn@latest add @buildora/masonry-layout"
}