{
  "$schema": "https://buildora-hazel.vercel.app/schema/registry-item.json",
  "id": "detent-dial",
  "name": "Detent Dial",
  "slug": "detent-dial",
  "description": "Rotary knob with Gaussian tick-wave emphasis around the active detent. Drag, wheel, or arrows; role=slider.",
  "categories": [
    "forms",
    "motion"
  ],
  "tags": [
    "dial",
    "knob",
    "rotary"
  ],
  "difficulty": "intermediate",
  "version": "0.1.0",
  "license": "MIT",
  "status": "beta",
  "collection": "creative",
  "states": [],
  "implementations": {
    "react": {
      "status": "Full",
      "files": [
        "packages/components/src/detent-dial/index.tsx"
      ]
    },
    "javascript": {
      "status": "Partial",
      "notes": "Snippet-level port. React is the source of truth; no dedicated JS runtime.",
      "files": [
        "packages/components/src/detent-dial/index.tsx"
      ]
    },
    "vue": {
      "status": "Partial",
      "notes": "Composition API snippet port. React is the source of truth.",
      "files": [
        "packages/components/src/detent-dial/index.tsx"
      ]
    },
    "svelte": {
      "status": "Partial",
      "notes": "Svelte runes snippet port. React is the source of truth.",
      "files": [
        "packages/components/src/detent-dial/index.tsx"
      ]
    },
    "angular": {
      "status": "Partial",
      "notes": "Angular @Input snippet port. React is the source of truth.",
      "files": [
        "packages/components/src/detent-dial/index.tsx"
      ]
    },
    "html": {
      "status": "Partial",
      "notes": "Static markup snippet. Interactive behavior requires the React implementation.",
      "files": [
        "packages/components/src/detent-dial/index.tsx"
      ]
    },
    "tailwind": {
      "status": "Partial",
      "notes": "Tailwind variant snippet, not a standalone component.",
      "files": [
        "packages/components/src/detent-dial/index.tsx"
      ]
    },
    "reactNative": {
      "status": "Partial",
      "notes": "No hover/cursor on mobile; use press + haptics. Snippet port.",
      "files": [
        "packages/components/src/detent-dial/index.tsx"
      ]
    },
    "flutter": {
      "status": "Experimental",
      "notes": "Experimental snippet port; pointer interactions remapped to gestures.",
      "files": [
        "packages/components/src/detent-dial/index.tsx"
      ]
    },
    "swiftUI": {
      "status": "Experimental",
      "notes": "Experimental snippet port; pointer interactions remapped.",
      "files": [
        "packages/components/src/detent-dial/index.tsx"
      ]
    },
    "compose": {
      "status": "Experimental",
      "notes": "Experimental snippet port; pointer interactions remapped.",
      "files": [
        "packages/components/src/detent-dial/index.tsx"
      ]
    }
  },
  "accessibility": {
    "keyboard": true,
    "screenReader": true,
    "reducedMotion": true
  },
  "dependencies": [],
  "registryDependencies": [
    "https://buildora-hazel.vercel.app/r/utils.json",
    "https://buildora-hazel.vercel.app/r/tokens.json",
    "https://buildora-hazel.vercel.app/r/use-reduced-motion.json"
  ],
  "provenance": {
    "origin": "original",
    "license": "MIT",
    "adapted": false
  },
  "files": [
    {
      "path": "packages/components/src/detent-dial/index.tsx",
      "target": "components/buildora/detent-dial.tsx",
      "content": "\"use client\";\n\nimport * as React from \"react\";\nimport { cn } from \"@/lib/buildora/utils\";\nimport { useReducedMotion } from \"@/hooks/buildora/use-reduced-motion\";\n\nexport type DetentDialProps = Omit<React.HTMLAttributes<HTMLDivElement>, \"onChange\" | \"defaultValue\"> & {\n  /** Number of snap detents around the sweep. */\n  detents?: number;\n  value?: number;\n  defaultValue?: number;\n  onChange?: (value: number) => void;\n  /** Sweep range in degrees (total, centered at 12 o'clock). */\n  sweep?: number;\n  size?: number;\n  label?: string;\n  /** Formats the numeric readout. */\n  format?: (v: number) => string;\n};\n\n/**\n * DetentDial — a rotary knob with a Gaussian tick wave around the active\n * detent. Drag, wheel, or arrow keys; each detent ticks with a haptic-style\n * settle. role=\"slider\" semantics.\n */\nexport function DetentDial({\n  detents = 24,\n  value,\n  defaultValue,\n  onChange,\n  sweep = 270,\n  size = 168,\n  label = \"Level\",\n  format,\n  className,\n  ...rest\n}: DetentDialProps) {\n  const reduced = useReducedMotion();\n  const [internal, setInternal] = React.useState(defaultValue ?? Math.floor(detents / 2));\n  const active = value ?? internal;\n  const knobRef = React.useRef<HTMLDivElement | null>(null);\n  const dragging = React.useRef(false);\n\n  const clamp = (v: number) => Math.max(0, Math.min(detents - 1, v));\n  const commit = (v: number) => {\n    const snapped = clamp(Math.round(v));\n    if (value === undefined) setInternal(snapped);\n    onChange?.(snapped);\n  };\n\n  const angleFromCenter = (e: PointerEvent | React.PointerEvent) => {\n    const knob = knobRef.current;\n    if (!knob) return 0;\n    const r = knob.getBoundingClientRect();\n    const cx = r.left + r.width / 2;\n    const cy = r.top + r.height / 2;\n    const dx = e.clientX - cx;\n    const dy = e.clientY - cy;\n    // 0deg = 12 o'clock, positive clockwise\n    let deg = (Math.atan2(dx, -dy) * 180) / Math.PI;\n    deg = Math.max(-sweep / 2, Math.min(sweep / 2, deg));\n    return deg;\n  };\n\n  React.useEffect(() => {\n    if (!dragging.current) return;\n    const onMove = (e: PointerEvent) => commit((angleFromCenter(e) + sweep / 2) / (sweep / (detents - 1)));\n    const onUp = () => {\n      dragging.current = false;\n    };\n    window.addEventListener(\"pointermove\", onMove);\n    window.addEventListener(\"pointerup\", onUp, { once: true });\n    return () => {\n      window.removeEventListener(\"pointermove\", onMove);\n      window.removeEventListener(\"pointerup\", onUp);\n    };\n    // eslint-disable-next-line react-hooks/exhaustive-deps\n  });\n\n  const onKey = (e: React.KeyboardEvent) => {\n    const n = active;\n    if (e.key === \"ArrowRight\" || e.key === \"ArrowUp\") commit(n + 1);\n    else if (e.key === \"ArrowLeft\" || e.key === \"ArrowDown\") commit(n - 1);\n    else if (e.key === \"Home\") commit(0);\n    else if (e.key === \"End\") commit(detents - 1);\n    else return;\n    e.preventDefault();\n  };\n\n  const rot = -sweep / 2 + (active / (detents - 1)) * sweep;\n  const R = size / 2;\n  const tickCount = detents;\n\n  return (\n    <div className={cn(\"inline-flex flex-col items-center gap-3\", className)} onKeyDown={onKey} {...rest}>\n      <div\n        ref={knobRef}\n        role=\"slider\"\n        tabIndex={0}\n        aria-valuemin={0}\n        aria-valuemax={detents - 1}\n        aria-valuenow={active}\n        aria-valuetext={format ? format(active) : String(active)}\n        aria-label={label}\n        aria-orientation=\"vertical\"\n        onPointerDown={(e) => {\n          (e.target as HTMLElement).setPointerCapture?.(e.pointerId);\n          dragging.current = true;\n          commit((angleFromCenter(e) + sweep / 2) / (sweep / (detents - 1)));\n        }}\n        onWheel={(e) => {\n          e.preventDefault();\n          commit(active + (e.deltaY > 0 ? -1 : 1));\n        }}\n        className={cn(\n          \"relative cursor-grab touch-none select-none rounded-full outline-none active:cursor-grabbing\",\n          \"bg-[color:var(--b-surface)] border border-[color:var(--b-border)]\",\n          \"focus-visible:ring-2 focus-visible:ring-[color:var(--b-accent)]\"\n        )}\n        style={{ width: size, height: size }}\n      >\n        {/* tick crown */}\n        <div className=\"absolute inset-0\" aria-hidden=\"true\">\n          {Array.from({ length: tickCount }, (_, i) => {\n            const a = -sweep / 2 + (i / (detents - 1)) * sweep;\n            const dist = Math.abs(i - active);\n            const wave = Math.exp(-(dist * dist) / 2.4); // gaussian emphasis\n            const len = 5 + wave * 7;\n            return (\n              <span\n                key={i}\n                className=\"absolute left-1/2 top-1/2 origin-bottom rounded-full transition-opacity duration-150\"\n                style={{\n                  width: 2.5,\n                  height: len,\n                  background: `color-mix(in oklab, var(--b-accent) ${Math.round(35 + wave * 65)}%, var(--b-border))`,\n                  transform: `translate(-50%,0) rotate(${a}deg) translateY(${-(R - 14)}px) translateY(-${len}px)`,\n                  opacity: 0.45 + wave * 0.55,\n                }}\n              />\n            );\n          })}\n        </div>\n\n        {/* knob face */}\n        <div\n          className=\"absolute inset-[26%] rounded-full border border-[color:var(--b-border)] bg-[color:var(--b-panel)] shadow-inner\"\n          style={{\n            transform: reduced ? `rotate(${rot}deg)` : `rotate(${rot}deg)`,\n            transition: reduced ? undefined : \"transform 320ms cubic-bezier(.22,1.4,.36,1)\",\n          }}\n        >\n          <span\n            className=\"absolute left-1/2 top-[7%] h-[34%] w-[3px] -translate-x-1/2 rounded-full bg-[color:var(--b-accent)]\"\n            aria-hidden=\"true\"\n          />\n        </div>\n      </div>\n      <span className=\"font-display text-xl font-bold tabular-nums text-[color:var(--b-text)]\" role=\"status\">\n        {format ? format(active) : active}\n      </span>\n    </div>\n  );\n}\n\nexport default DetentDial;\n"
    }
  ],
  "github": "https://github.com/Varun9490/Buildora/tree/main/packages/components/src/detent-dial",
  "githubFile": "https://github.com/Varun9490/Buildora/blob/main/packages/components/src/detent-dial/index.tsx",
  "sourceDir": "detent-dial",
  "docs": "/components/detent-dial",
  "install": "pnpm dlx shadcn@latest add @buildora/detent-dial"
}