{
  "$schema": "https://buildora-hazel.vercel.app/schema/registry-item.json",
  "id": "utils",
  "name": "Utils",
  "slug": "utils",
  "description": "cn + clamp + fuzzyScore + formatBytes. Shared class-name helper for every component.",
  "categories": [
    "primitives"
  ],
  "tags": [
    "utils",
    "cn",
    "foundation"
  ],
  "difficulty": "beginner",
  "version": "0.1.0",
  "license": "MIT",
  "status": "stable",
  "collection": "kit",
  "states": [],
  "implementations": {
    "react": {
      "status": "Full",
      "files": [
        "registry/shared/utils.ts"
      ]
    },
    "javascript": {
      "status": "Full",
      "notes": "Snippet-level port. React is the source of truth; no dedicated JS runtime.",
      "files": [
        "registry/shared/utils.ts"
      ]
    },
    "vue": {
      "status": "Full",
      "notes": "Composition API snippet port. React is the source of truth.",
      "files": [
        "registry/shared/utils.ts"
      ]
    },
    "svelte": {
      "status": "Full",
      "notes": "Svelte runes snippet port. React is the source of truth.",
      "files": [
        "registry/shared/utils.ts"
      ]
    },
    "angular": {
      "status": "Full",
      "notes": "Angular @Input snippet port. React is the source of truth.",
      "files": [
        "registry/shared/utils.ts"
      ]
    },
    "html": {
      "status": "Full",
      "notes": "Static markup snippet. Interactive behavior requires the React implementation.",
      "files": [
        "registry/shared/utils.ts"
      ]
    },
    "tailwind": {
      "status": "Full",
      "notes": "Tailwind variant snippet, not a standalone component.",
      "files": [
        "registry/shared/utils.ts"
      ]
    },
    "reactNative": {
      "status": "Unsupported",
      "notes": "No hover/cursor on mobile; use press + haptics. Snippet port.",
      "files": []
    },
    "flutter": {
      "status": "Unsupported",
      "notes": "Experimental snippet port; pointer interactions remapped to gestures.",
      "files": []
    },
    "swiftUI": {
      "status": "Unsupported",
      "notes": "Experimental snippet port; pointer interactions remapped.",
      "files": []
    },
    "compose": {
      "status": "Unsupported",
      "notes": "Experimental snippet port; pointer interactions remapped.",
      "files": []
    }
  },
  "accessibility": {
    "keyboard": true,
    "screenReader": true,
    "reducedMotion": true
  },
  "dependencies": [
    "clsx",
    "tailwind-merge"
  ],
  "registryDependencies": [],
  "provenance": {
    "origin": "original",
    "license": "MIT",
    "adapted": false
  },
  "files": [
    {
      "path": "registry/shared/utils.ts",
      "target": "lib/buildora/utils.ts",
      "content": "import { clsx, type ClassValue } from \"clsx\";\nimport { twMerge } from \"tailwind-merge\";\n\n/** Merge class names with Tailwind conflict resolution. Installs to lib/buildora/utils.ts */\nexport function cn(...inputs: ClassValue[]) {\n  return twMerge(clsx(inputs));\n}\n\nexport function clamp(n: number, min: number, max: number) {\n  return Math.min(max, Math.max(min, n));\n}\n\n/** Linear interpolation between a and b at t (0..1) */\nexport function lerp(a: number, b: number, t: number) {\n  return a + (b - a) * t;\n}\n\n/** Deterministic id for SSR-safe useId fallback */\nlet nextIdCounter = 0;\nexport function nextId(prefix = \"b\") {\n  nextIdCounter += 1;\n  return `${prefix}-${nextIdCounter}`;\n}\n\nexport function formatBytes(bytes: number, decimals = 1) {\n  if (!Number.isFinite(bytes) || bytes <= 0) return \"0 B\";\n  const k = 1024;\n  const dm = Math.max(0, decimals);\n  const sizes = [\"B\", \"KB\", \"MB\", \"GB\", \"TB\", \"PB\"];\n  const i = Math.min(sizes.length - 1, Math.floor(Math.log(bytes) / Math.log(k)));\n  return `${parseFloat((bytes / Math.pow(k, i)).toFixed(dm))} ${sizes[i]}`;\n}\n\n/** Clipboard write with a non-secure-context fallback. Never throws. */\nexport function copyToClipboard(text: string): Promise<boolean> {\n  if (typeof navigator !== \"undefined\" && navigator.clipboard?.writeText) {\n    return navigator.clipboard.writeText(text).then(\n      () => true,\n      () => copyViaExecCommand(text)\n    );\n  }\n  return copyViaExecCommand(text);\n}\n\nfunction copyViaExecCommand(text: string): Promise<boolean> {\n  try {\n    const ta = document.createElement(\"textarea\");\n    ta.value = text;\n    ta.setAttribute(\"readonly\", \"\");\n    ta.style.position = \"fixed\";\n    ta.style.opacity = \"0\";\n    document.body.appendChild(ta);\n    ta.select();\n    const ok = document.execCommand(\"copy\");\n    document.body.removeChild(ta);\n    return Promise.resolve(ok);\n  } catch {\n    return Promise.resolve(false);\n  }\n}\n\nexport function debounce<T extends (...args: never[]) => void>(fn: T, ms: number) {\n  let t: ReturnType<typeof setTimeout> | undefined;\n  return (...args: Parameters<T>) => {\n    if (t) clearTimeout(t);\n    t = setTimeout(() => fn(...args), ms);\n  };\n}\n\n/** Fuzzy match score (0..1+, higher is better) for command-palette / search ranking */\nexport function fuzzyScore(query: string, target: string): number {\n  const q = query.toLowerCase().trim();\n  const s = target.toLowerCase();\n  if (!q) return 1;\n  if (s.includes(q)) return 2 + q.length / Math.max(s.length, 1);\n  let qi = 0;\n  let score = 0;\n  for (let i = 0; i < s.length && qi < q.length; i++) {\n    if (s[i] === q[qi]) {\n      score += 1;\n      qi++;\n    }\n  }\n  return qi === q.length ? score / s.length : 0;\n}\n"
    }
  ],
  "github": "https://github.com/Varun9490/Buildora/tree/main/registry/shared/utils.ts",
  "githubFile": "https://github.com/Varun9490/Buildora/blob/main/registry/shared/utils.ts",
  "sourceDir": "registry/shared/utils.ts",
  "docs": "/components/utils",
  "install": "pnpm dlx shadcn@latest add @buildora/utils"
}