{
  "$schema": "https://buildora-hazel.vercel.app/schema/registry-item.json",
  "id": "step-nav",
  "name": "Step Nav",
  "slug": "step-nav",
  "description": "Stepper navigation with current-step state.",
  "categories": [
    "navigation"
  ],
  "tags": [
    "stepper",
    "steps"
  ],
  "difficulty": "beginner",
  "version": "0.1.0",
  "license": "MIT",
  "status": "beta",
  "collection": "kit",
  "states": [],
  "implementations": {
    "react": {
      "status": "Full",
      "files": [
        "packages/components/src/navigation/step-nav.tsx"
      ]
    },
    "javascript": {
      "status": "Partial",
      "notes": "Snippet-level port. React is the source of truth; no dedicated JS runtime.",
      "files": [
        "packages/components/src/navigation/step-nav.tsx"
      ]
    },
    "vue": {
      "status": "Partial",
      "notes": "Composition API snippet port. React is the source of truth.",
      "files": [
        "packages/components/src/navigation/step-nav.tsx"
      ]
    },
    "svelte": {
      "status": "Partial",
      "notes": "Svelte runes snippet port. React is the source of truth.",
      "files": [
        "packages/components/src/navigation/step-nav.tsx"
      ]
    },
    "angular": {
      "status": "Partial",
      "notes": "Angular @Input snippet port. React is the source of truth.",
      "files": [
        "packages/components/src/navigation/step-nav.tsx"
      ]
    },
    "html": {
      "status": "Partial",
      "notes": "Static markup snippet. Interactive behavior requires the React implementation.",
      "files": [
        "packages/components/src/navigation/step-nav.tsx"
      ]
    },
    "tailwind": {
      "status": "Partial",
      "notes": "Tailwind variant snippet, not a standalone component.",
      "files": [
        "packages/components/src/navigation/step-nav.tsx"
      ]
    },
    "reactNative": {
      "status": "Partial",
      "notes": "No hover/cursor on mobile; use press + haptics. Snippet port.",
      "files": [
        "packages/components/src/navigation/step-nav.tsx"
      ]
    },
    "flutter": {
      "status": "Experimental",
      "notes": "Experimental snippet port; pointer interactions remapped to gestures.",
      "files": [
        "packages/components/src/navigation/step-nav.tsx"
      ]
    },
    "swiftUI": {
      "status": "Experimental",
      "notes": "Experimental snippet port; pointer interactions remapped.",
      "files": [
        "packages/components/src/navigation/step-nav.tsx"
      ]
    },
    "compose": {
      "status": "Experimental",
      "notes": "Experimental snippet port; pointer interactions remapped.",
      "files": [
        "packages/components/src/navigation/step-nav.tsx"
      ]
    }
  },
  "accessibility": {
    "keyboard": true,
    "screenReader": true,
    "reducedMotion": true
  },
  "dependencies": [],
  "registryDependencies": [
    "https://buildora-hazel.vercel.app/r/utils.json",
    "https://buildora-hazel.vercel.app/r/tokens.json",
    "https://buildora-hazel.vercel.app/r/use-reduced-motion.json"
  ],
  "provenance": {
    "origin": "original",
    "license": "MIT",
    "adapted": false
  },
  "files": [
    {
      "path": "packages/components/src/navigation/step-nav.tsx",
      "target": "components/buildora/step-nav/step-nav.tsx",
      "content": "\"use client\";\n\nimport * as React from \"react\";\nimport { cn } from \"@/lib/buildora/utils\";\nimport { useReducedMotion } from \"@/hooks/buildora/use-reduced-motion\";\n\nconst StepNavContext = React.createContext<{\n  currentStep: number;\n  setCurrentStep: (value: number) => void;\n  totalSteps: number;\n} | null>(null);\n\nexport type StepNavProps = React.HTMLAttributes<HTMLElement> & {\n  defaultStep?: number;\n  currentStep?: number;\n  onStepChange?: (step: number) => void;\n  totalSteps?: number;\n};\n\nconst StepNav = React.forwardRef<HTMLElement, StepNavProps>(\n  ({ className, defaultStep, currentStep: controlledStep, onStepChange, totalSteps = 0, children, ...props }, ref) => {\n    const [currentStep, setCurrentStep] = React.useState(controlledStep ?? defaultStep ?? 0);\n\n    React.useEffect(() => {\n      if (controlledStep !== undefined) {\n        setCurrentStep(controlledStep);\n      }\n    }, [controlledStep]);\n\n    const handleSetStep = (value: number) => {\n      setCurrentStep(value);\n      onStepChange?.(value);\n    };\n\n    const childCount = React.Children.count(children);\n    const actualTotalSteps = totalSteps || childCount;\n\n    return (\n      <StepNavContext.Provider value={{ currentStep, setCurrentStep: handleSetStep, totalSteps: actualTotalSteps }}>\n        <nav\n          ref={ref}\n          role=\"navigation\"\n          aria-label=\"Step navigation\"\n          className={cn(\"flex items-center\", className)}\n          {...props}\n        >\n          <ol role=\"list\" className=\"flex items-center gap-2\">\n            {React.Children.map(children, (child, index) => {\n              if (React.isValidElement(child)) {\n                return React.cloneElement(child as React.ReactElement<{ step: number; totalSteps: number }>, {\n                  step: index,\n                  totalSteps: actualTotalSteps,\n                });\n              }\n              return child;\n            })}\n          </ol>\n        </nav>\n      </StepNavContext.Provider>\n    );\n  }\n);\n\nStepNav.displayName = \"StepNav\";\n\nexport type StepNavItemProps = Omit<React.HTMLAttributes<HTMLDivElement>, \"title\"> & {\n  step?: number;\n  totalSteps?: number;\n  title?: string;\n  icon?: React.ReactNode;\n};\n\nconst StepNavItem = React.forwardRef<HTMLDivElement, StepNavItemProps>(\n  ({ className, step = 0, totalSteps = 0, title, icon, children, ...props }, ref) => {\n    const context = React.useContext(StepNavContext);\n    if (!context) throw new Error(\"StepNavItem must be used within StepNav\");\n    const reducedMotion = useReducedMotion();\n\n    const isActive = context.currentStep === step;\n    const isCompleted = context.currentStep > step;\n    const isClickable = step <= context.currentStep;\n\n    const handleClick = () => {\n      if (isClickable) {\n        context.setCurrentStep(step);\n      }\n    };\n\n    const handleKeyDown = (e: React.KeyboardEvent) => {\n      if (e.key === \"Enter\" || e.key === \" \") {\n        e.preventDefault();\n        handleClick();\n      }\n    };\n\n    return (\n      <li className=\"flex items-center\">\n        <div\n          ref={ref}\n          role=\"listitem\"\n          aria-current={isActive ? \"step\" : undefined}\n          aria-disabled={!isClickable}\n          tabIndex={isClickable ? 0 : -1}\n          onClick={handleClick}\n          onKeyDown={handleKeyDown}\n          className={cn(\n            \"flex items-center gap-2 transition-colors\",\n            isClickable ? \"cursor-pointer\" : \"cursor-not-allowed\",\n            \"focus-visible:outline-none focus-visible:ring-2 focus-visible:ring-[color-mix(in_oklab,var(--b-accent)_50%,transparent)] rounded-lg\",\n            !reducedMotion && \"duration-200\",\n            className\n          )}\n          {...props}\n        >\n          <div\n            className={cn(\n              \"flex h-8 w-8 items-center justify-center rounded-full border-2 text-sm font-semibold transition-colors\",\n              !reducedMotion && \"duration-200\",\n              isCompleted\n                ? \"border-[color:var(--b-accent)] bg-[color:var(--b-accent)] text-[color:var(--b-accent-foreground)]\"\n                : isActive\n                  ? \"border-[color:var(--b-accent)] bg-[color-mix(in_oklab,var(--b-accent)_10%,transparent)] text-[color:var(--b-accent)]\"\n                  : \"border-[color-mix(in_oklab,var(--b-border)_20%,transparent)] bg-transparent text-[color-mix(in_oklab,var(--b-text)_40%,transparent)]\"\n            )}\n          >\n            {icon || (isCompleted ? (\n              <svg className=\"h-4 w-4\" fill=\"none\" viewBox=\"0 0 24 24\" stroke=\"currentColor\">\n                <path strokeLinecap=\"round\" strokeLinejoin=\"round\" strokeWidth={2} d=\"M5 13l4 4L19 7\" />\n              </svg>\n            ) : (\n              step + 1\n            ))}\n          </div>\n          {title && (\n            <span\n              className={cn(\n                \"text-sm font-medium transition-colors\",\n                !reducedMotion && \"duration-200\",\n                isActive ? \"text-[color:var(--b-text)]\" : isCompleted ? \"text-[color-mix(in_oklab,var(--b-text)_60%,transparent)]\" : \"text-[color-mix(in_oklab,var(--b-text)_40%,transparent)]\"\n              )}\n            >\n              {title}\n            </span>\n          )}\n        </div>\n        {step < totalSteps - 1 && (\n          <div\n            className={cn(\n              \"mx-2 h-0.5 w-8 transition-colors\",\n              !reducedMotion && \"duration-200\",\n              isCompleted ? \"bg-[color:var(--b-accent)]\" : \"bg-[color-mix(in_oklab,var(--b-text)_10%,transparent)]\"\n            )}\n          />\n        )}\n      </li>\n    );\n  }\n);\n\nStepNavItem.displayName = \"StepNavItem\";\n\nexport { StepNav, StepNavItem };\n"
    }
  ],
  "github": "https://github.com/Varun9490/Buildora/tree/main/packages/components/src/navigation/step-nav.tsx",
  "githubFile": "https://github.com/Varun9490/Buildora/blob/main/packages/components/src/navigation/step-nav.tsx",
  "sourceDir": "navigation/step-nav.tsx",
  "docs": "/components/step-nav",
  "install": "pnpm dlx shadcn@latest add @buildora/step-nav"
}